landid,bezeichnung,impf_voraussetzungen,impf_empfehlungen,quelle_url
1,Aegypten,"Der Nachweis einer Gelbfieberimpfung wird für alle Personen ab einem Alter von neun Monaten gefordert, die aus einem Gelbfieberinfektionsgebiet (sowie zusätzlich Eritrea, Ruanda, Somalia, Tansania oder Sambia) einreisen oder sich dort mehr als 12 Stunden im Transit aufgehalten haben. Der Nachweis einer Poliomyelitis-Impfung innerhalb von 12 Monaten bis vier Wochen vor Einreise wird von allen Reisenden verlangt, die aus der Demokratischen Republik Kongo, Kenia, Niger oder Syrien einreisen.","Als Reiseimpfungen werden Impfungen gegen Hepatitis A, bei Langzeitaufenthalten oder besonderer Exposition auch gegen Dengueieber, Hepatitis B, Typhus, Tollwut und Meningokokken-Krankheit (ACWY) empfohlen.",https://www.auswaertiges-amt.de/de/service/laender/aegypten-node/aegyptensicherheit/212622
2,Aequatorialguinea,"Bei Einreise aus einem Gelbfiebergebiet müssen alle Personen ab einem Alter von neun Monaten eine Gelbfieberimpfung nachweisen, gelegentlich gibt es auch Kontrollen bei Einreise aus Deutschland. noch der Nachweis einer Auffrischimpfung nach zehn Jahren verlangt. Abweichend von offiziellen Regelungen kann der Nachweis einer Choleraimpfung verlangt werden, besonders bei Einreise über Land oder aus einem Endemiegebiet.","Als Reiseimpfungen werden Impfungen gegen Hepatitis A und Poliomyelitis, bei Langzeitaufenthalt oder besonderer Exposition auch gegen Hepatitis B, Typhus, Tollwut und Meningokokken-Krankheit (ACWY) empfohlen.",https://www.auswaertiges-amt.de/de/service/laender/aequatorialguinea-node/aequatorialguineasicherheit/226768
3,Aethiopien,Keine Angaben,Keine Angaben,https://www.auswaertiges-amt.de/de/service/laender/aethiopien-node/aethiopiensicherheit/209504
4,Afghanistan,Bei Einreise aus einem Gebiet mit Fällen von Poliomyelitis (Kinderlähmung) ist der Nachweis einer Polio-Impfung zu erbringen.,"Als Reiseimpfungen werden Impfungen gegen Hepatitis A und Polio, bei Langzeitaufenthalt oder besonderer Exposition auch gegen Typhus, Hepatitis B und Tollwut empfohlen.",https://www.auswaertiges-amt.de/de/service/laender/afghanistan-node/afghanistansicherheit/204692
5,Ägypten,"Der Nachweis einer Gelbfieberimpfung wird für alle Personen ab einem Alter von neun Monaten gefordert, die aus einem Gelbfieberinfektionsgebiet (sowie zusätzlich Eritrea, Ruanda, Somalia, Tansania oder Sambia) einreisen oder sich dort mehr als 12 Stunden im Transit aufgehalten haben. Der Nachweis einer Poliomyelitis-Impfung innerhalb von 12 Monaten bis vier Wochen vor Einreise wird von allen Reisenden verlangt, die aus der Demokratischen Republik Kongo, Kenia, Niger oder Syrien einreisen.","Als Reiseimpfungen werden Impfungen gegen Hepatitis A, bei Langzeitaufenthalten oder besonderer Exposition auch gegen Dengueieber, Hepatitis B, Typhus, Tollwut und Meningokokken-Krankheit (ACWY) empfohlen.",https://www.auswaertiges-amt.de/de/service/laender/aegypten-node/aegyptensicherheit/212622
